"DESCRIPTION","DURATION IN MS","NAME","PARENT SUITE","START TIME","STATUS","STOP TIME","SUB SUITE","SUITE","TEST CLASS","TEST METHOD"
"Проверка создания автомобиля с валидными данными со страницы Cars -> Create new","44019","Проверка создания автомобиля с валидными данными со страницы Cars -> Create new","AllTestSuite","Fri Jul 10 13:58:13 UTC 2026","passed","Fri Jul 10 13:58:57 UTC 2026","tests.ui.cars.CarsTest","AllTests-Chrome","tests.ui.cars.CarsTest","testCreateNewCar"
"Создание пользователя с невалидным возрастом","510","Проверка создания пользователя с невалидным возрастом","AllTestSuite","Fri Jul 10 13:53:44 UTC 2026","failed","Fri Jul 10 13:53:45 UTC 2026","tests.api.users.UsersApiTest","AllTests-Chrome","tests.api.users.UsersApiTest","testCreateUserWithInvalidAge"
"Проверка сортировки пользователей по возрастанию ID","20121","Проверка сортировки пользователей по возрастанию ID","AllTestSuite","Fri Jul 10 15:46:29 UTC 2026","passed","Fri Jul 10 15:46:50 UTC 2026","tests.ui.users.UsersReadAllTest","AllTests-Chrome","tests.ui.users.UsersReadAllTest","checkSortByIDIncrease"
"","5796","Проверка обработки невалидных данных при создании пользователя","AllTestSuite","Fri Jul 10 16:09:27 UTC 2026","passed","Fri Jul 10 16:09:33 UTC 2026","tests.ui.users.CreateUserTest","AllTests-Chrome","tests.ui.users.CreateUserTest","testInvalidUserData"
"Проверка сортировки пользователей по возрастанию наличности","20465","Проверка сортировки пользователей по возрастанию наличности","AllTestSuite","Fri Jul 10 15:53:04 UTC 2026","passed","Fri Jul 10 15:53:25 UTC 2026","tests.ui.users.UsersReadAllTest","AllTests-Chrome","tests.ui.users.UsersReadAllTest","checkSortByMoneyIncrease"
"Проверка доступности выполнений действий для авторизованного пользователя (создать пользователя)","14268","Проверка доступности выполнений действий для авторизованного пользователя (создать пользователя)","AllTestSuite","Fri Jul 10 15:29:20 UTC 2026","passed","Fri Jul 10 15:29:34 UTC 2026","tests.ui.login.LoginTest","AllTests-Chrome","tests.ui.login.LoginTest","checkingTheAvailabilityOfActionsForAnAuthorizedUser"
"Проверка валидации полей с получением ошибок при вводе невалидных значений","35718","Проверка валидации полей с получением ошибок при вводе невалидных значений","AllTestSuite","Fri Jul 10 15:56:02 UTC 2026","failed","Fri Jul 10 15:56:38 UTC 2026","tests.ui.users.UsersReadUserWithCarsTest","AllTests-Chrome","tests.ui.users.UsersReadUserWithCarsTest","checkDataInTableUserNegativeId"
"Проверка создания дома с заполнением обязательных полей {floors} и {price} валидными кредами и получением успешного кода выполнения операции","32250","Проверка создания дома с заполнением обязательных полей {floors} и {price} валидными кредами и получением успешного кода выполнения операции","AllTestSuite","Fri Jul 10 15:20:57 UTC 2026","passed","Fri Jul 10 15:21:30 UTC 2026","tests.ui.houses.HousesTest","AllTests-Chrome","tests.ui.houses.HousesTest","checkingTheCreationOfAHouseByFillingInTheRequiredFieldsWithValidCredits"
"Проверка корректной сортировки первых 30 значений атрибута Price таблицы Cars по убыванию","55911","Проверка корректной сортировки первых 30 значений атрибута Price таблицы Cars по убыванию","AllTestSuite","Fri Jul 10 14:53:11 UTC 2026","passed","Fri Jul 10 14:54:06 UTC 2026","tests.ui.cars.CarsTest","AllTests-Chrome","tests.ui.cars.CarsTest","checkSortPriceHighLow"
"Запрос автомобиля с несуществующим id GET /car/{carId}","260","Запрос автомобиля с несуществующим id GET /car/{carId}","AllTestSuite","Fri Jul 10 13:51:23 UTC 2026","failed","Fri Jul 10 13:51:23 UTC 2026","tests.api.cars.CarsApiTest","AllTests-Chrome","tests.api.cars.CarsApiTest","checkNegativeGetCar"
"Проверка корректной сортировки первых 30 значений атрибута Price таблицы Cars по убыванию","53261","Проверка корректной сортировки первых 30 значений атрибута Price таблицы Cars по возрастанию","AllTestSuite","Fri Jul 10 14:54:07 UTC 2026","passed","Fri Jul 10 14:55:00 UTC 2026","tests.ui.cars.CarsTest","AllTests-Chrome","tests.ui.cars.CarsTest","checkSortPriceLowHigh"
"Проверка отображения данных по пользователю без машины","6487","Проверка отображения данных по пользователю без машины","AllTestSuite","Fri Jul 10 15:56:58 UTC 2026","passed","Fri Jul 10 15:57:05 UTC 2026","tests.ui.users.UsersReadUserWithCarsTest","AllTests-Chrome","tests.ui.users.UsersReadUserWithCarsTest","checkDataInTableUserWithoutCar"
"","6053","Проверка обработки невалидных данных при создании пользователя","AllTestSuite","Fri Jul 10 16:12:07 UTC 2026","failed","Fri Jul 10 16:12:13 UTC 2026","tests.ui.users.CreateUserTest","AllTests-Chrome","tests.ui.users.CreateUserTest","testInvalidUserData"
"Проверка обновления таблицы","129170","Проверка обновления таблицы","AllTestSuite","Fri Jul 10 15:41:15 UTC 2026","passed","Fri Jul 10 15:43:24 UTC 2026","tests.ui.users.UsersReadAllTest","AllTests-Chrome","tests.ui.users.UsersReadAllTest","checkReloadButton"
"API проверка обновления авто POST /car с невалидным телом","1769","API проверка обновления авто POST /car с невалидным телом","AllTestSuite","Fri Jul 10 13:51:24 UTC 2026","passed","Fri Jul 10 13:51:26 UTC 2026","tests.api.cars.CarsApiTest","AllTests-Chrome","tests.api.cars.CarsApiTest","checkNegativeUpdateCarBrokeBody"
"","5786","Проверка обработки ошибок при пополнении баланса","AllTestSuite","Fri Jul 10 15:59:47 UTC 2026","passed","Fri Jul 10 15:59:52 UTC 2026","tests.ui.users.UsersAddMoneyTest","AllTests-Chrome","tests.ui.users.UsersAddMoneyTest","testAddMoneyInvalid"
"","5981","Проверка обработки невалидных данных при создании пользователя","AllTestSuite","Fri Jul 10 16:11:40 UTC 2026","failed","Fri Jul 10 16:11:46 UTC 2026","tests.ui.users.CreateUserTest","AllTests-Chrome","tests.ui.users.CreateUserTest","testInvalidUserData"
"","21855","Проверка корректного увеличения баланса пользователя","AllTestSuite","Fri Jul 10 16:04:11 UTC 2026","failed","Fri Jul 10 16:04:33 UTC 2026","tests.ui.users.UsersAddMoneyTest","AllTests-Chrome","tests.ui.users.UsersAddMoneyTest","testAddMoneySuccess"
"Проверка корректной сортировки первых 30 значений атрибута Model таблицы Cars А-Я","142538","Проверка корректной сортировки первых 30 значений атрибута Model таблицы Cars А-Я","AllTestSuite","Fri Jul 10 14:47:12 UTC 2026","failed","Fri Jul 10 14:49:34 UTC 2026","tests.ui.cars.CarsTest","AllTests-Chrome","tests.ui.cars.CarsTest","checkSortModelAZ"
"Проверка валидации страницы 'Authorization' на наличие всех элементов.","29401","Проверка валидации страницы 'Authorization' на наличие всех элементов","AllTestSuite","Fri Jul 10 15:29:35 UTC 2026","passed","Fri Jul 10 15:30:04 UTC 2026","tests.ui.login.LoginTest","AllTests-Chrome","tests.ui.login.LoginTest","checkingTheValidityOfTheAuthorizationPage"
"Полный цикл CRUD: создание, операции и удаление пользователя, автомобиля и дома","13605","E2E-сценарий: создание пользователя -> пополнение баланса -> создание авто -> покупка/продажа авто -> создание дома -> заселение/выселение -> удаление всех сущностей","AllTestSuite","Fri Jul 10 13:53:51 UTC 2026","passed","Fri Jul 10 13:54:04 UTC 2026","tests.ui.allPost.AllPostTest","AllTests-Chrome","tests.ui.allPost.AllPostTest","testFullUserFlow"
"Проверка создания автомобиля с валидными данными со страницы Cars -> Create new","7865","Проверка создания автомобиля с валидными данными со страницы Cars -> Create new","AllTestSuite","Fri Jul 10 14:09:02 UTC 2026","failed","Fri Jul 10 14:09:10 UTC 2026","tests.ui.cars.CarsTest","AllTests-Chrome","tests.ui.cars.CarsTest","testCreateNewCar"
"API проверка создания авто POST /car с невалидным телом","338","API проверка создания авто POST /car с невалидным телом","AllTestSuite","Fri Jul 10 13:51:18 UTC 2026","passed","Fri Jul 10 13:51:18 UTC 2026","tests.api.cars.CarsApiTest","AllTests-Chrome","tests.api.cars.CarsApiTest","checkNegativeCreateCar"
"Проверка создания автомобиля с невалидными данными со страницы Cars -> Create new","6553","Проверка создания автомобиля с невалидными данными со страницы Cars -> Create new","AllTestSuite","Fri Jul 10 14:16:20 UTC 2026","passed","Fri Jul 10 14:16:27 UTC 2026","tests.ui.cars.CarsTest","AllTests-Chrome","tests.ui.cars.CarsTest","testErrorCreateCar"
"","5364","Проверка обработки ошибок при пополнении баланса","AllTestSuite","Fri Jul 10 15:59:53 UTC 2026","passed","Fri Jul 10 15:59:58 UTC 2026","tests.ui.users.UsersAddMoneyTest","AllTests-Chrome","tests.ui.users.UsersAddMoneyTest","testAddMoneyInvalid"
"Проверка ввода невалидных значений в поля idUser и idCar на странице Cars -> Buy or Sell","7173","Проверка ввода невалидных значений в поля idUser и idCar на странице Cars -> Buy or Sell","AllTestSuite","Fri Jul 10 15:09:10 UTC 2026","passed","Fri Jul 10 15:09:18 UTC 2026","tests.ui.cars.CarsTest","AllTests-Chrome","tests.ui.cars.CarsTest","testInputIdUserError"
"Удаление автомобиля с несуществующим id DELETE /car/{carId}","262","Удаление автомобиля с несуществующим id DELETE /car/{carId}","AllTestSuite","Fri Jul 10 13:51:21 UTC 2026","passed","Fri Jul 10 13:51:21 UTC 2026","tests.api.cars.CarsApiTest","AllTests-Chrome","tests.api.cars.CarsApiTest","checkNegativeDeleteCar"
"Проверка недоступности выполнений действий для неавторизованного пользователя (создать пользователя)","66233","Проверка недоступности выполнений действий для неавторизованного пользователя(создать пользователя)","AllTestSuite","Fri Jul 10 15:30:04 UTC 2026","passed","Fri Jul 10 15:31:11 UTC 2026","tests.ui.login.LoginTest","AllTests-Chrome","tests.ui.login.LoginTest","checkingWhetherActionsCanBePerformedByAnUnauthorizedUser"
"","5796","Проверка обработки невалидных данных при создании пользователя","AllTestSuite","Fri Jul 10 16:11:15 UTC 2026","passed","Fri Jul 10 16:11:20 UTC 2026","tests.ui.users.CreateUserTest","AllTests-Chrome","tests.ui.users.CreateUserTest","testInvalidUserData"
"Авторизация с пустым телом запроса","258","Авторизация с пустым телом запроса","AllTestSuite","Fri Jul 10 13:53:48 UTC 2026","passed","Fri Jul 10 13:53:48 UTC 2026","tests.api.login.LoginApiTest","AllTests-Chrome","tests.api.login.LoginApiTest","checkingAuthorizationRequestWithAnEmptyRequestBodyAPI"
"Проверка открытия страницы ""Users -> Read all"" со всеми атрибутами","96917","Проверка открытия страницы ""Users -> Read all"" со всеми атрибутами","AllTestSuite","Fri Jul 10 15:39:37 UTC 2026","passed","Fri Jul 10 15:41:14 UTC 2026","tests.ui.users.UsersReadAllTest","AllTests-Chrome","tests.ui.users.UsersReadAllTest","checkOpenUsersReadAllPage"
"Проверка ввода невалидных значений в поля idUser и idCar на странице Cars -> Buy or Sell","94312","Проверка ввода невалидных значений в поля idUser и idCar на странице Cars -> Buy or Sell","AllTestSuite","Fri Jul 10 15:19:23 UTC 2026","failed","Fri Jul 10 15:20:57 UTC 2026","tests.ui.cars.CarsTest","AllTests-Chrome","tests.ui.cars.CarsTest","testInputIdUserError"
"Проверка ховер-эффектов и тултипов","35325","Проверка ховер-эффектов и тултипов","AllTestSuite","Fri Jul 10 15:58:53 UTC 2026","failed","Fri Jul 10 15:59:28 UTC 2026","tests.ui.users.UsersReadUserWithCarsTest","AllTests-Chrome","tests.ui.users.UsersReadUserWithCarsTest","checkHoverEffectAndTooltip"
