"DESCRIPTION","DURATION IN MS","NAME","PARENT SUITE","START TIME","STATUS","STOP TIME","SUB SUITE","SUITE","TEST CLASS","TEST METHOD"
"Проверка создания автомобиля с невалидными данными со страницы Cars -> Create new","6350","Проверка создания автомобиля с невалидными данными со страницы Cars -> Create new","AllTestSuite","Sun Jul 12 12:51:08 UTC 2026","passed","Sun Jul 12 12:51:14 UTC 2026","tests.ui.cars.CarsTest","AllTests-Chrome","tests.ui.cars.CarsTest","testErrorCreateCar"
"Проверка корректной сортировки первых 30 значений атрибута Price таблицы Cars по убыванию","22004","Проверка корректной сортировки первых 30 значений атрибута Price таблицы Cars по убыванию","AllTestSuite","Sun Jul 12 13:02:46 UTC 2026","passed","Sun Jul 12 13:03:08 UTC 2026","tests.ui.cars.CarsTest","AllTests-Chrome","tests.ui.cars.CarsTest","checkSortPriceHighLow"
"Проверка открытия страницы ""Users -> Read user with cars"" со всеми атрибутами","5931","Проверка открытия страницы ""Users -> Read user with cars"" со всеми атрибутами","AllTestSuite","Sun Jul 12 13:25:57 UTC 2026","passed","Sun Jul 12 13:26:03 UTC 2026","tests.ui.users.UsersReadUserWithCarsTest","AllTests-Chrome","tests.ui.users.UsersReadUserWithCarsTest","checkOpenUsersReadUserWithCarsPage"
"API проверка создания авто POST /car с невалидным телом","265","API проверка создания авто POST /car с невалидным телом","AllTestSuite","Sun Jul 12 12:47:55 UTC 2026","passed","Sun Jul 12 12:47:56 UTC 2026","tests.api.cars.CarsApiTest","AllTests-Chrome","tests.api.cars.CarsApiTest","checkNegativeCreateCar"
"Проверка валидации полей на странице 'Houses/Create new' с получением ошибок при вводе невалидных значений","7575","Проверка валидации полей на странице 'Houses/Create new' с получением ошибок при вводе невалидных значений","AllTestSuite","Sun Jul 12 13:07:47 UTC 2026","passed","Sun Jul 12 13:07:54 UTC 2026","tests.ui.houses.HousesTest","AllTests-Chrome","tests.ui.houses.HousesTest","checkingTheValidationOfFieldsOnTheHousesCreateNewPageAndReceivingErrorsWhenEnteringInvalidValues"
"Создание пользователя с невалидным возрастом","565","Проверка создания пользователя с невалидным возрастом","AllTestSuite","Sun Jul 12 12:48:28 UTC 2026","failed","Sun Jul 12 12:48:29 UTC 2026","tests.api.users.UsersApiTest","AllTests-Chrome","tests.api.users.UsersApiTest","testCreateUserWithInvalidAge"
"Проверка корректной работы радиокнопки Buy на странице Cars -> Buy or Sell","6679","Проверка корректной работы радиокнопки Buy на странице Cars -> Buy or Sell","AllTestSuite","Sun Jul 12 12:53:10 UTC 2026","passed","Sun Jul 12 12:53:16 UTC 2026","tests.ui.cars.CarsTest","AllTests-Chrome","tests.ui.cars.CarsTest","testRadioButtonBuy"
"API проверка списка всех авто с помощью ручки GET /cars","1474","API проверка списка всех авто с помощью ручки GET /cars","AllTestSuite","Sun Jul 12 12:47:52 UTC 2026","failed","Sun Jul 12 12:47:54 UTC 2026","tests.api.cars.CarsApiTest","AllTests-Chrome","tests.api.cars.CarsApiTest","checkGetAllCars"
"Авторизация с пустым телом запроса","262","Авторизация с пустым телом запроса","AllTestSuite","Sun Jul 12 12:48:32 UTC 2026","passed","Sun Jul 12 12:48:32 UTC 2026","tests.api.login.LoginApiTest","AllTests-Chrome","tests.api.login.LoginApiTest","checkingAuthorizationRequestWithAnEmptyRequestBodyAPI"
"Проверка создания автомобиля с невалидными данными со страницы Cars -> Create new","6339","Проверка создания автомобиля с невалидными данными со страницы Cars -> Create new","AllTestSuite","Sun Jul 12 12:52:16 UTC 2026","passed","Sun Jul 12 12:52:23 UTC 2026","tests.ui.cars.CarsTest","AllTests-Chrome","tests.ui.cars.CarsTest","testErrorCreateCar"
"API проверка обновления авто POST /car с невалидным телом","1800","API проверка обновления авто POST /car с невалидным телом","AllTestSuite","Sun Jul 12 12:48:10 UTC 2026","passed","Sun Jul 12 12:48:11 UTC 2026","tests.api.cars.CarsApiTest","AllTests-Chrome","tests.api.cars.CarsApiTest","checkNegativeUpdateCarBrokeBody"
"Проверка валидации полей с получением ошибок при вводе невалидных значений","5719","Проверка валидации полей с получением ошибок при вводе невалидных значений","AllTestSuite","Sun Jul 12 13:20:29 UTC 2026","passed","Sun Jul 12 13:20:35 UTC 2026","tests.ui.users.UsersReadUserWithCarsTest","AllTests-Chrome","tests.ui.users.UsersReadUserWithCarsTest","checkDataInTableUserNegativeId"
"Проверка отображения данных по пользователю c одной машиной","7381","Проверка отображения данных по пользователю c одной машиной","AllTestSuite","Sun Jul 12 13:23:13 UTC 2026","passed","Sun Jul 12 13:23:21 UTC 2026","tests.ui.users.UsersReadUserWithCarsTest","AllTests-Chrome","tests.ui.users.UsersReadUserWithCarsTest","checkDataInTableUserWithOneCar"
"","5350","Проверка обработки ошибок при пополнении баланса","AllTestSuite","Sun Jul 12 13:26:16 UTC 2026","passed","Sun Jul 12 13:26:21 UTC 2026","tests.ui.users.UsersAddMoneyTest","AllTests-Chrome","tests.ui.users.UsersAddMoneyTest","testAddMoneyInvalid"
"Проверка авторизации с пустым значением 'Password' и валидным 'Email'","2047","Проверка авторизации с пустым значением 'Password' и валидным 'Email'","AllTestSuite","Sun Jul 12 13:09:00 UTC 2026","passed","Sun Jul 12 13:09:02 UTC 2026","tests.ui.login.LoginTest","AllTests-Chrome","tests.ui.login.LoginTest","checkingAuthorizationWithAnEmptyPasswordValueAndAValidEmail"
"Проверка, что кнопка Reload на странице Car -> read all, обновляет страницу с таблицей","14247","Проверка, что кнопка Reload на странице Car -> read all, обновляет страницу с таблицей","AllTestSuite","Sun Jul 12 13:04:17 UTC 2026","passed","Sun Jul 12 13:04:31 UTC 2026","tests.ui.cars.CarsTest","AllTests-Chrome","tests.ui.cars.CarsTest","checkReloadButton"
"Позитивный сценарий создания пользователя","17835","Проверка успешного создания пользователя и его отображения в системе","AllTestSuite","Sun Jul 12 13:35:41 UTC 2026","failed","Sun Jul 12 13:35:59 UTC 2026","tests.ui.users.CreateUserTest","AllTests-Chrome","tests.ui.users.CreateUserTest","createValidUserTest"
"Проверка устойчивости формы авторизации к SQL-инъекциям через поле 'Password'","2089","Проверка того, что ввод SQL-пейлоада в поле пароля не ломает БД и выдает стандартный алерт","AllTestSuite","Sun Jul 12 13:08:16 UTC 2026","passed","Sun Jul 12 13:08:18 UTC 2026","tests.ui.login.LoginTest","AllTests-Chrome","tests.ui.login.LoginTest","checkingPasswordSqlInjectionProtectionSoft"
"Авторизация пользователя с валидными данными 'Email' и 'Password'.","2603","Проверка авторизации с валидными данными (валидный email + пароль) иотображения сообщения об успешном входе.","AllTestSuite","Sun Jul 12 13:08:55 UTC 2026","passed","Sun Jul 12 13:08:57 UTC 2026","tests.ui.login.LoginTest","AllTests-Chrome","tests.ui.login.LoginTest","positiveAuthorization"
"Проверка ховер-эффектов и тултипов","35470","Проверка ховер-эффектов и тултипов","AllTestSuite","Sun Jul 12 13:25:15 UTC 2026","failed","Sun Jul 12 13:25:51 UTC 2026","tests.ui.users.UsersReadUserWithCarsTest","AllTests-Chrome","tests.ui.users.UsersReadUserWithCarsTest","checkHoverEffectAndTooltip"
"Проверка валидации полей на странице 'Houses/Create new' с получением ошибок при вводе невалидных значений","7602","Проверка валидации полей на странице 'Houses/Create new' с получением ошибок при вводе невалидных значений","AllTestSuite","Sun Jul 12 13:07:23 UTC 2026","passed","Sun Jul 12 13:07:30 UTC 2026","tests.ui.houses.HousesTest","AllTests-Chrome","tests.ui.houses.HousesTest","checkingTheValidationOfFieldsOnTheHousesCreateNewPageAndReceivingErrorsWhenEnteringInvalidValues"
"Проверка валидации страницы 'Authorization' на наличие всех элементов.","1879","Проверка валидации страницы 'Authorization' на наличие всех элементов","AllTestSuite","Sun Jul 12 13:08:44 UTC 2026","passed","Sun Jul 12 13:08:46 UTC 2026","tests.ui.login.LoginTest","AllTests-Chrome","tests.ui.login.LoginTest","checkingTheValidityOfTheAuthorizationPage"
"Проверка сортировки пользователей по убыванию наличности","23905","Проверка сортировки пользователей по убыванию наличности","AllTestSuite","Sun Jul 12 13:19:03 UTC 2026","passed","Sun Jul 12 13:19:27 UTC 2026","tests.ui.users.UsersReadAllTest","AllTests-Chrome","tests.ui.users.UsersReadAllTest","checkSortByMoneyDecrease"
"Проверка создания автомобиля с валидными данными со страницы Cars -> Create new","6336","Проверка создания автомобиля с валидными данными со страницы Cars -> Create new","AllTestSuite","Sun Jul 12 12:49:46 UTC 2026","passed","Sun Jul 12 12:49:53 UTC 2026","tests.ui.cars.CarsTest","AllTests-Chrome","tests.ui.cars.CarsTest","testCreateNewCar"
"","6015","Проверка обработки невалидных данных при создании пользователя","AllTestSuite","Sun Jul 12 13:36:32 UTC 2026","failed","Sun Jul 12 13:36:38 UTC 2026","tests.ui.users.CreateUserTest","AllTests-Chrome","tests.ui.users.CreateUserTest","testInvalidUserData"
"Получение несуществующего пользователя","268","Проверка получения несуществующего пользователя","AllTestSuite","Sun Jul 12 12:48:23 UTC 2026","passed","Sun Jul 12 12:48:23 UTC 2026","tests.api.users.UsersApiTest","AllTests-Chrome","tests.api.users.UsersApiTest","testGetNonExistentUser"
"","5848","Проверка обработки невалидных данных при создании пользователя","AllTestSuite","Sun Jul 12 13:36:00 UTC 2026","passed","Sun Jul 12 13:36:06 UTC 2026","tests.ui.users.CreateUserTest","AllTests-Chrome","tests.ui.users.CreateUserTest","testInvalidUserData"
"","5710","Проверка обработки невалидных данных при создании пользователя","AllTestSuite","Sun Jul 12 13:36:45 UTC 2026","passed","Sun Jul 12 13:36:50 UTC 2026","tests.ui.users.CreateUserTest","AllTests-Chrome","tests.ui.users.CreateUserTest","testInvalidUserData"
"Проверка недоступности выполнений действий для неавторизованного пользователя (создать пользователя)","5356","Проверка недоступности выполнений действий для неавторизованного пользователя(создать пользователя)","AllTestSuite","Sun Jul 12 13:08:46 UTC 2026","passed","Sun Jul 12 13:08:51 UTC 2026","tests.ui.login.LoginTest","AllTests-Chrome","tests.ui.login.LoginTest","checkingWhetherActionsCanBePerformedByAnUnauthorizedUser"
"","5721","Проверка обработки невалидных данных при создании пользователя","AllTestSuite","Sun Jul 12 13:37:55 UTC 2026","passed","Sun Jul 12 13:38:01 UTC 2026","tests.ui.users.CreateUserTest","AllTests-Chrome","tests.ui.users.CreateUserTest","testInvalidUserData"
"Проверка устойчивости формы авторизации к SQL-инъекциям через поле 'Password'","2206","Проверка того, что ввод SQL-пейлоада в поле пароля не ломает БД и выдает стандартный алерт","AllTestSuite","Sun Jul 12 13:08:13 UTC 2026","passed","Sun Jul 12 13:08:16 UTC 2026","tests.ui.login.LoginTest","AllTests-Chrome","tests.ui.login.LoginTest","checkingPasswordSqlInjectionProtectionSoft"
"Проверка ввода невалидных значений в поля idUser и idCar на странице Cars -> Buy or Sell","7266","Проверка ввода невалидных значений в поля idUser и idCar на странице Cars -> Buy or Sell","AllTestSuite","Sun Jul 12 13:06:18 UTC 2026","failed","Sun Jul 12 13:06:25 UTC 2026","tests.ui.cars.CarsTest","AllTests-Chrome","tests.ui.cars.CarsTest","testInputIdUserError"
"","5946","Проверка обработки ошибок при пополнении баланса","AllTestSuite","Sun Jul 12 13:26:09 UTC 2026","passed","Sun Jul 12 13:26:15 UTC 2026","tests.ui.users.UsersAddMoneyTest","AllTests-Chrome","tests.ui.users.UsersAddMoneyTest","testAddMoneyInvalid"
"Проверка отображения данных по пользователю без машины","6394","Проверка отображения данных по пользователю без машины","AllTestSuite","Sun Jul 12 13:23:21 UTC 2026","passed","Sun Jul 12 13:23:27 UTC 2026","tests.ui.users.UsersReadUserWithCarsTest","AllTests-Chrome","tests.ui.users.UsersReadUserWithCarsTest","checkDataInTableUserWithoutCar"
"Обновление данных пользователя через PUT /user/{userId}","593","Проверка обновления пользователя через PUT /user/{userId}","AllTestSuite","Sun Jul 12 12:48:20 UTC 2026","passed","Sun Jul 12 12:48:20 UTC 2026","tests.api.users.UsersApiTest","AllTests-Chrome","tests.api.users.UsersApiTest","testUpdateUser"
"Проверка корректной сортировки значений атрибута Engine Type таблицы Cars А-Я","10418","Проверка корректной сортировки значений атрибута Engine Type таблицы Cars А-Я","AllTestSuite","Sun Jul 12 12:53:24 UTC 2026","passed","Sun Jul 12 12:53:34 UTC 2026","tests.ui.cars.CarsTest","AllTests-Chrome","tests.ui.cars.CarsTest","checkSortEngineAZ"
"Изменение автомобиля с несуществующим id GET /car/{carId}","269","Изменение автомобиля с несуществующим id GET /car/{carId}","AllTestSuite","Sun Jul 12 12:48:00 UTC 2026","passed","Sun Jul 12 12:48:01 UTC 2026","tests.api.cars.CarsApiTest","AllTests-Chrome","tests.api.cars.CarsApiTest","checkNegativeUpdateCar"
"Создание пользователя с отрицательным балансом","284","Проверка создания пользователя с отрицательным балансом","AllTestSuite","Sun Jul 12 12:48:31 UTC 2026","failed","Sun Jul 12 12:48:31 UTC 2026","tests.api.users.UsersApiTest","AllTests-Chrome","tests.api.users.UsersApiTest","testCreateUserWithNegativeBalance"
"Проверка корректной сортировки значений атрибута Engine Type таблицы Cars Я-А","12687","Проверка корректной сортировки значений атрибута Engine Type таблицы Cars Я-А","AllTestSuite","Sun Jul 12 12:53:35 UTC 2026","passed","Sun Jul 12 12:53:48 UTC 2026","tests.ui.cars.CarsTest","AllTests-Chrome","tests.ui.cars.CarsTest","checkSortEngineZA"
"Проверка ввода валидных значений в поля idUser и idCar на странице Cars -> Buy or Sell","7353","Проверка ввода разных значений в поля idUser и idCar на странице Cars -> Buy or Sell","AllTestSuite","Sun Jul 12 12:53:02 UTC 2026","failed","Sun Jul 12 12:53:09 UTC 2026","tests.ui.cars.CarsTest","AllTests-Chrome","tests.ui.cars.CarsTest","testInputIdUser"
"Запрос автомобиля несуществующего пользователя GET /user/{userId}/cars","283","Запрос автомобиля несуществующего пользователя GET /user/{userId}/cars","AllTestSuite","Sun Jul 12 12:48:12 UTC 2026","passed","Sun Jul 12 12:48:12 UTC 2026","tests.api.cars.CarsApiTest","AllTests-Chrome","tests.api.cars.CarsApiTest","checkNegativeUserCar"
"Проверка валидации полей на странице 'Houses/Create new' с получением ошибок при вводе невалидных значений","7606","Проверка валидации полей на странице 'Houses/Create new' с получением ошибок при вводе невалидных значений","AllTestSuite","Sun Jul 12 13:07:55 UTC 2026","passed","Sun Jul 12 13:08:02 UTC 2026","tests.ui.houses.HousesTest","AllTests-Chrome","tests.ui.houses.HousesTest","checkingTheValidationOfFieldsOnTheHousesCreateNewPageAndReceivingErrorsWhenEnteringInvalidValues"
"Проверка ввода валидных значений в поля idUser и idCar на странице Cars -> Buy or Sell","7305","Проверка ввода разных значений в поля idUser и idCar на странице Cars -> Buy or Sell","AllTestSuite","Sun Jul 12 12:52:31 UTC 2026","passed","Sun Jul 12 12:52:38 UTC 2026","tests.ui.cars.CarsTest","AllTests-Chrome","tests.ui.cars.CarsTest","testInputIdUser"
"Проверка валидации полей с получением ошибок при вводе невалидных значений","35831","Проверка валидации полей с получением ошибок при вводе невалидных значений","AllTestSuite","Sun Jul 12 13:22:25 UTC 2026","failed","Sun Jul 12 13:23:00 UTC 2026","tests.ui.users.UsersReadUserWithCarsTest","AllTests-Chrome","tests.ui.users.UsersReadUserWithCarsTest","checkDataInTableUserNegativeId"
"Проверка сортировки пользователей по убыванию ID","23809","Проверка сортировки пользователей по убыванию ID","AllTestSuite","Sun Jul 12 13:15:21 UTC 2026","passed","Sun Jul 12 13:15:45 UTC 2026","tests.ui.users.UsersReadAllTest","AllTests-Chrome","tests.ui.users.UsersReadAllTest","checkSortByIDDecrease"
"Проверка валидации поля 'Password' при вводе значений > 8 символов.","2037","Проверка валидации поля 'Password' при вводе значений > 8 символов","AllTestSuite","Sun Jul 12 13:09:08 UTC 2026","passed","Sun Jul 12 13:09:10 UTC 2026","tests.ui.login.LoginTest","AllTests-Chrome","tests.ui.login.LoginTest","checkThePasswordFieldIfTheValueIsGreaterThanEight"
"Проверка создания автомобиля с невалидными данными со страницы Cars -> Create new","6437","Проверка создания автомобиля с невалидными данными со страницы Cars -> Create new","AllTestSuite","Sun Jul 12 12:52:10 UTC 2026","failed","Sun Jul 12 12:52:16 UTC 2026","tests.ui.cars.CarsTest","AllTests-Chrome","tests.ui.cars.CarsTest","testErrorCreateCar"
"Позитивный сценарий создания пользователя","17971","Проверка успешного создания пользователя и его отображения в системе","AllTestSuite","Sun Jul 12 13:34:27 UTC 2026","failed","Sun Jul 12 13:34:45 UTC 2026","tests.ui.users.CreateUserTest","AllTests-Chrome","tests.ui.users.CreateUserTest","createValidUserTest"
"Проверка наличия всех атрибутов в таблице Cars -> read all","5268","Проверка наличия всех атрибутов в таблице Cars -> read all","AllTestSuite","Sun Jul 12 12:48:59 UTC 2026","passed","Sun Jul 12 12:49:05 UTC 2026","tests.ui.cars.CarsTest","AllTests-Chrome","tests.ui.cars.CarsTest","testAttributeCarsTable"
"Создание пользователя без обязательных полей","268","Проверка создания пользователя без обязательных полей","AllTestSuite","Sun Jul 12 12:48:25 UTC 2026","passed","Sun Jul 12 12:48:25 UTC 2026","tests.api.users.UsersApiTest","AllTests-Chrome","tests.api.users.UsersApiTest","testCreateUserWithoutRequiredFields"
"Проверка обновления таблицы","101972","Проверка обновления таблицы","AllTestSuite","Sun Jul 12 13:12:10 UTC 2026","passed","Sun Jul 12 13:13:52 UTC 2026","tests.ui.users.UsersReadAllTest","AllTests-Chrome","tests.ui.users.UsersReadAllTest","checkReloadButton"
"","6176","Проверка обработки невалидных данных при создании пользователя","AllTestSuite","Sun Jul 12 13:37:42 UTC 2026","failed","Sun Jul 12 13:37:49 UTC 2026","tests.ui.users.CreateUserTest","AllTests-Chrome","tests.ui.users.CreateUserTest","testInvalidUserData"
"Проверка валидации полей на странице 'Houses/Create new' с получением ошибок при вводе невалидных значений","7603","Проверка валидации полей на странице 'Houses/Create new' с получением ошибок при вводе невалидных значений","AllTestSuite","Sun Jul 12 13:07:39 UTC 2026","passed","Sun Jul 12 13:07:46 UTC 2026","tests.ui.houses.HousesTest","AllTests-Chrome","tests.ui.houses.HousesTest","checkingTheValidationOfFieldsOnTheHousesCreateNewPageAndReceivingErrorsWhenEnteringInvalidValues"
"Авторизация с невалидным email","356","Авторизация с невалидным email","AllTestSuite","Sun Jul 12 12:48:32 UTC 2026","passed","Sun Jul 12 12:48:32 UTC 2026","tests.api.login.LoginApiTest","AllTests-Chrome","tests.api.login.LoginApiTest","checkingAuthorizationWithInvalidEmailAPI"
"Проверка сортировки пользователей по фамилии от A-Z","19667","Проверка сортировки пользователей по фамилии от A-Z","AllTestSuite","Sun Jul 12 13:18:43 UTC 2026","failed","Sun Jul 12 13:19:02 UTC 2026","tests.ui.users.UsersReadAllTest","AllTests-Chrome","tests.ui.users.UsersReadAllTest","checkSortByLastNameIncrease"
"Проверка устойчивости формы авторизации к SQL-инъекциям через поле 'Password'","2087","Проверка того, что ввод SQL-пейлоада в поле пароля не ломает БД и выдает стандартный алерт","AllTestSuite","Sun Jul 12 13:08:24 UTC 2026","passed","Sun Jul 12 13:08:26 UTC 2026","tests.ui.login.LoginTest","AllTests-Chrome","tests.ui.login.LoginTest","checkingPasswordSqlInjectionProtectionSoft"
"Проверка создания автомобиля с валидными данными со страницы Cars -> Create new","6392","Проверка создания автомобиля с валидными данными со страницы Cars -> Create new","AllTestSuite","Sun Jul 12 12:49:39 UTC 2026","passed","Sun Jul 12 12:49:46 UTC 2026","tests.ui.cars.CarsTest","AllTests-Chrome","tests.ui.cars.CarsTest","testCreateNewCar"
"Проверка создания автомобиля с невалидными данными со страницы Cars -> Create new","6446","Проверка создания автомобиля с невалидными данными со страницы Cars -> Create new","AllTestSuite","Sun Jul 12 12:51:15 UTC 2026","passed","Sun Jul 12 12:51:21 UTC 2026","tests.ui.cars.CarsTest","AllTests-Chrome","tests.ui.cars.CarsTest","testErrorCreateCar"
"Проверка ввода невалидных значений в поля idUser и idCar на странице Cars -> Buy or Sell","7305","Проверка ввода невалидных значений в поля idUser и idCar на странице Cars -> Buy or Sell","AllTestSuite","Sun Jul 12 13:05:39 UTC 2026","passed","Sun Jul 12 13:05:47 UTC 2026","tests.ui.cars.CarsTest","AllTests-Chrome","tests.ui.cars.CarsTest","testInputIdUserError"
