"DESCRIPTION","DURATION IN MS","NAME","PARENT SUITE","START TIME","STATUS","STOP TIME","SUB SUITE","SUITE","TEST CLASS","TEST METHOD"
"Проверка валидации полей с получением ошибок при вводе невалидных значений","5817","Проверка валидации полей с получением ошибок при вводе невалидных значений","AllTestSuite","Sun Jul 12 13:23:01 UTC 2026","passed","Sun Jul 12 13:23:07 UTC 2026","tests.ui.users.UsersReadUserWithCarsTest","AllTests-Chrome","tests.ui.users.UsersReadUserWithCarsTest","checkDataInTableUserNegativeId"
"Проверка доступности выполнений действий для авторизованного пользователя (создать пользователя)","14364","Проверка доступности выполнений действий для авторизованного пользователя (создать пользователя)","AllTestSuite","Sun Jul 12 13:08:29 UTC 2026","passed","Sun Jul 12 13:08:43 UTC 2026","tests.ui.login.LoginTest","AllTests-Chrome","tests.ui.login.LoginTest","checkingTheAvailabilityOfActionsForAnAuthorizedUser"
"Проверка корректной сортировки первых 30 значений атрибута Price таблицы Cars по убыванию","61257","Проверка корректной сортировки первых 30 значений атрибута Price таблицы Cars по возрастанию","AllTestSuite","Sun Jul 12 13:03:08 UTC 2026","passed","Sun Jul 12 13:04:09 UTC 2026","tests.ui.cars.CarsTest","AllTests-Chrome","tests.ui.cars.CarsTest","checkSortPriceLowHigh"
"Проверка создания автомобиля с валидными данными со страницы Cars -> Create new","6352","Проверка создания автомобиля с валидными данными со страницы Cars -> Create new","AllTestSuite","Sun Jul 12 12:50:20 UTC 2026","passed","Sun Jul 12 12:50:27 UTC 2026","tests.ui.cars.CarsTest","AllTests-Chrome","tests.ui.cars.CarsTest","testCreateNewCar"
"Проверка авторизации с пустым значением 'Email' и валидным 'Password'","2052","Проверка авторизации с пустым значением 'Email' и валидным 'Password'","AllTestSuite","Sun Jul 12 13:08:58 UTC 2026","passed","Sun Jul 12 13:09:00 UTC 2026","tests.ui.login.LoginTest","AllTests-Chrome","tests.ui.login.LoginTest","checkingAuthorizationWithAnEmptyEmailValueAndAValidPassword"
"Получение списка всех пользователей через GET /users","2354","Проверка получения списка пользователей через GET /users","AllTestSuite","Sun Jul 12 12:48:15 UTC 2026","passed","Sun Jul 12 12:48:18 UTC 2026","tests.api.users.UsersApiTest","AllTests-Chrome","tests.api.users.UsersApiTest","testGetAllUsers"
"Проверка валидации полей на странице 'Houses/Create new' с получением ошибок при вводе невалидных значений","7683","Проверка валидации полей на странице 'Houses/Create new' с получением ошибок при вводе невалидных значений","AllTestSuite","Sun Jul 12 13:08:03 UTC 2026","passed","Sun Jul 12 13:08:10 UTC 2026","tests.ui.houses.HousesTest","AllTests-Chrome","tests.ui.houses.HousesTest","checkingTheValidationOfFieldsOnTheHousesCreateNewPageAndReceivingErrorsWhenEnteringInvalidValues"
"Проверка сортировки пользователей по возрастанию возраста","19807","Проверка сортировки пользователей по возрастанию возраста","AllTestSuite","Sun Jul 12 13:14:16 UTC 2026","passed","Sun Jul 12 13:14:36 UTC 2026","tests.ui.users.UsersReadAllTest","AllTests-Chrome","tests.ui.users.UsersReadAllTest","checkSortByAgeIncrease"
"Проверка валидации полей с получением ошибок при вводе невалидных значений","5669","Проверка валидации полей с получением ошибок при вводе невалидных значений","AllTestSuite","Sun Jul 12 13:23:07 UTC 2026","passed","Sun Jul 12 13:23:13 UTC 2026","tests.ui.users.UsersReadUserWithCarsTest","AllTests-Chrome","tests.ui.users.UsersReadUserWithCarsTest","checkDataInTableUserNegativeId"
"","6145","Проверка обработки невалидных данных при создании пользователя","AllTestSuite","Sun Jul 12 13:38:47 UTC 2026","failed","Sun Jul 12 13:38:54 UTC 2026","tests.ui.users.CreateUserTest","AllTests-Chrome","tests.ui.users.CreateUserTest","testInvalidUserData"
"API проверка создания авто POST /car с невалидным телом","394","API проверка создания авто POST /car с невалидным телом","AllTestSuite","Sun Jul 12 12:47:54 UTC 2026","passed","Sun Jul 12 12:47:54 UTC 2026","tests.api.cars.CarsApiTest","AllTests-Chrome","tests.api.cars.CarsApiTest","checkNegativeCreateCar"
"Проверка ввода в поле Price на странице Cars -> Create new, с помощью стрелок","10965","Проверка ввода в поле Price на странице Cars -> Create new, с помощью стрелок","AllTestSuite","Sun Jul 12 13:04:42 UTC 2026","passed","Sun Jul 12 13:04:53 UTC 2026","tests.ui.cars.CarsTest","AllTests-Chrome","tests.ui.cars.CarsTest","testArrowNumberInput"
"","22773","Проверка корректного увеличения баланса пользователя","AllTestSuite","Sun Jul 12 13:27:36 UTC 2026","failed","Sun Jul 12 13:27:59 UTC 2026","tests.ui.users.UsersAddMoneyTest","AllTests-Chrome","tests.ui.users.UsersAddMoneyTest","testAddMoneySuccess"
"Проверка сортировки пользователей по полу от A-Z","19451","Проверка сортировки пользователей по полу от A-Z","AllTestSuite","Sun Jul 12 13:20:09 UTC 2026","passed","Sun Jul 12 13:20:29 UTC 2026","tests.ui.users.UsersReadAllTest","AllTests-Chrome","tests.ui.users.UsersReadAllTest","checkSortBySexIncrease"
"API проверка обновления авто POST /car с невалидным телом","1770","API проверка обновления авто POST /car с невалидным телом","AllTestSuite","Sun Jul 12 12:48:03 UTC 2026","passed","Sun Jul 12 12:48:05 UTC 2026","tests.api.cars.CarsApiTest","AllTests-Chrome","tests.api.cars.CarsApiTest","checkNegativeUpdateCarBrokeBody"
"Проверка корректной работы радиокнопки Sell на странице Cars -> Buy or Sell","6715","Проверка корректной работы радиокнопки Sell на странице Cars -> Buy or Sell","AllTestSuite","Sun Jul 12 12:53:17 UTC 2026","passed","Sun Jul 12 12:53:24 UTC 2026","tests.ui.cars.CarsTest","AllTests-Chrome","tests.ui.cars.CarsTest","testRadioButtonSell"
"Проверка корректной сортировки первых 30 значений атрибута Model таблицы Cars А-Я","30182","Проверка корректной сортировки первых 30 значений атрибута Model таблицы Cars А-Я","AllTestSuite","Sun Jul 12 12:59:51 UTC 2026","failed","Sun Jul 12 13:00:22 UTC 2026","tests.ui.cars.CarsTest","AllTests-Chrome","tests.ui.cars.CarsTest","checkSortModelAZ"
"Полный цикл CRUD: создание, операции и удаление пользователя, автомобиля и дома","16299","E2E-сценарий: создание пользователя -> пополнение баланса -> создание авто -> покупка/продажа авто -> создание дома -> заселение/выселение -> удаление всех сущностей","AllTestSuite","Sun Jul 12 12:48:43 UTC 2026","passed","Sun Jul 12 12:48:59 UTC 2026","tests.ui.allPost.AllPostTest","AllTests-Chrome","tests.ui.allPost.AllPostTest","testFullUserFlow"
"Получение пользователя по ID через GET /user/{userId}","573","Проверка получения пользователя через GET /user/{userId}","AllTestSuite","Sun Jul 12 12:48:14 UTC 2026","passed","Sun Jul 12 12:48:15 UTC 2026","tests.api.users.UsersApiTest","AllTests-Chrome","tests.api.users.UsersApiTest","testGetUserById"
"","5723","Проверка обработки невалидных данных при создании пользователя","AllTestSuite","Sun Jul 12 13:36:06 UTC 2026","passed","Sun Jul 12 13:36:12 UTC 2026","tests.ui.users.CreateUserTest","AllTests-Chrome","tests.ui.users.CreateUserTest","testInvalidUserData"
"","5782","Проверка обработки невалидных данных при создании пользователя","AllTestSuite","Sun Jul 12 13:37:49 UTC 2026","passed","Sun Jul 12 13:37:55 UTC 2026","tests.ui.users.CreateUserTest","AllTests-Chrome","tests.ui.users.CreateUserTest","testInvalidUserData"
"Проверка сортировки пользователей по убыванию возраста","23524","Проверка сортировки пользователей по убыванию возраста","AllTestSuite","Sun Jul 12 13:13:52 UTC 2026","passed","Sun Jul 12 13:14:16 UTC 2026","tests.ui.users.UsersReadAllTest","AllTests-Chrome","tests.ui.users.UsersReadAllTest","checkSortByAgeDecrease"
"Проверка отображения сообщений об ошибке при пустых значениях 'Email' и 'Password'","2000","Проверка отображения сообщений об ошибке при пустых значениях 'Email' и 'Password'","AllTestSuite","Sun Jul 12 13:09:03 UTC 2026","passed","Sun Jul 12 13:09:05 UTC 2026","tests.ui.login.LoginTest","AllTests-Chrome","tests.ui.login.LoginTest","checkingTheDisplayOfErrorMessagesOnTheAuthorizationPage"
"","6013","Проверка обработки невалидных данных при создании пользователя","AllTestSuite","Sun Jul 12 13:38:22 UTC 2026","failed","Sun Jul 12 13:38:28 UTC 2026","tests.ui.users.CreateUserTest","AllTests-Chrome","tests.ui.users.CreateUserTest","testInvalidUserData"
"Проверка ввода невалидных значений в поля idUser и idCar на странице Cars -> Buy or Sell","7217","Проверка ввода невалидных значений в поля idUser и idCar на странице Cars -> Buy or Sell","AllTestSuite","Sun Jul 12 13:05:24 UTC 2026","failed","Sun Jul 12 13:05:31 UTC 2026","tests.ui.cars.CarsTest","AllTests-Chrome","tests.ui.cars.CarsTest","testInputIdUserError"
"Проверка ввода в поле Price на странице Cars -> Create new, с помощью стрелок","9794","Проверка ввода в поле Price на странице Cars -> Buy or Sell, с помощью стрелок","AllTestSuite","Sun Jul 12 13:04:32 UTC 2026","passed","Sun Jul 12 13:04:41 UTC 2026","tests.ui.cars.CarsTest","AllTests-Chrome","tests.ui.cars.CarsTest","testArrowInputUser"
"Проверка сортировки пользователей по возрастанию ID","20098","Проверка сортировки пользователей по возрастанию ID","AllTestSuite","Sun Jul 12 13:15:45 UTC 2026","passed","Sun Jul 12 13:16:05 UTC 2026","tests.ui.users.UsersReadAllTest","AllTests-Chrome","tests.ui.users.UsersReadAllTest","checkSortByIDIncrease"
"Проверка ховер эффекта кнопок","40721","Проверка ховер эффекта кнопок","AllTestSuite","Sun Jul 12 13:11:17 UTC 2026","failed","Sun Jul 12 13:11:58 UTC 2026","tests.ui.users.UsersReadAllTest","AllTests-Chrome","tests.ui.users.UsersReadAllTest","checkHoverEffect"
"Проверка создания дома с заполнением всех полей валидными кредами (включая необязательные","9781","Проверка создания дома с заполнением всех полей валидными кредами (включая необязательные)","AllTestSuite","Sun Jul 12 13:07:04 UTC 2026","passed","Sun Jul 12 13:07:14 UTC 2026","tests.ui.houses.HousesTest","AllTests-Chrome","tests.ui.houses.HousesTest","checkingTheCreationOfAHouseWithAllFieldsFilledWithValidCredits"
"Проверка устойчивости формы авторизации к SQL-инъекциям через поле 'Password'","2124","Проверка того, что ввод SQL-пейлоада в поле пароля не ломает БД и выдает стандартный алерт","AllTestSuite","Sun Jul 12 13:08:21 UTC 2026","passed","Sun Jul 12 13:08:23 UTC 2026","tests.ui.login.LoginTest","AllTests-Chrome","tests.ui.login.LoginTest","checkingPasswordSqlInjectionProtectionSoft"
"Проверка устойчивости формы авторизации к SQL-инъекциям через поле 'Password'","2056","Проверка того, что ввод SQL-пейлоада в поле пароля не ломает БД и выдает стандартный алерт","AllTestSuite","Sun Jul 12 13:08:18 UTC 2026","passed","Sun Jul 12 13:08:21 UTC 2026","tests.ui.login.LoginTest","AllTests-Chrome","tests.ui.login.LoginTest","checkingPasswordSqlInjectionProtectionSoft"
"","22262","Проверка корректного увеличения баланса пользователя","AllTestSuite","Sun Jul 12 13:30:41 UTC 2026","failed","Sun Jul 12 13:31:03 UTC 2026","tests.ui.users.UsersAddMoneyTest","AllTests-Chrome","tests.ui.users.UsersAddMoneyTest","testAddMoneySuccess"
"Проверка аллерта после ввода невалидного 'Email' валидного 'Password' и нажатия 'GO'","2520","Проверка аллерта после ввода невалидного 'Email' валидного 'Password' и нажатия 'GO'","AllTestSuite","Sun Jul 12 13:08:52 UTC 2026","passed","Sun Jul 12 13:08:54 UTC 2026","tests.ui.login.LoginTest","AllTests-Chrome","tests.ui.login.LoginTest","emailValidationCheckWithoutDomainWithErrorInformationMessage"
"Запрос автомобиля с несуществующим id GET /car/{carId}","269","Запрос автомобиля с несуществующим id GET /car/{carId}","AllTestSuite","Sun Jul 12 12:48:00 UTC 2026","failed","Sun Jul 12 12:48:00 UTC 2026","tests.api.cars.CarsApiTest","AllTests-Chrome","tests.api.cars.CarsApiTest","checkNegativeGetCar"
"Проверка корректной сортировки первых 30 значений атрибута Mark таблицы Cars Я-А","35868","Проверка корректной сортировки первых 30 значений атрибута Mark таблицы Cars Я-А","AllTestSuite","Sun Jul 12 12:57:42 UTC 2026","failed","Sun Jul 12 12:58:18 UTC 2026","tests.ui.cars.CarsTest","AllTests-Chrome","tests.ui.cars.CarsTest","checkSortMarkZA"
"","22763","Проверка корректного увеличения баланса пользователя","AllTestSuite","Sun Jul 12 13:29:09 UTC 2026","failed","Sun Jul 12 13:29:31 UTC 2026","tests.ui.users.UsersAddMoneyTest","AllTests-Chrome","tests.ui.users.UsersAddMoneyTest","testAddMoneySuccess"
"","5715","Проверка обработки невалидных данных при создании пользователя","AllTestSuite","Sun Jul 12 13:36:39 UTC 2026","passed","Sun Jul 12 13:36:44 UTC 2026","tests.ui.users.CreateUserTest","AllTests-Chrome","tests.ui.users.CreateUserTest","testInvalidUserData"
"Проверка ввода невалидных значений в поля idUser и idCar на странице Cars -> Buy or Sell","7316","Проверка ввода невалидных значений в поля idUser и idCar на странице Cars -> Buy or Sell","AllTestSuite","Sun Jul 12 13:04:53 UTC 2026","passed","Sun Jul 12 13:05:01 UTC 2026","tests.ui.cars.CarsTest","AllTests-Chrome","tests.ui.cars.CarsTest","testInputIdUserError"
"API проверка получения авто конкретного пользователя GET /user/{userId}/cars","2048","API проверка получения авто конкретного пользователя GET /user/{userId}/cars","AllTestSuite","Sun Jul 12 12:47:44 UTC 2026","failed","Sun Jul 12 12:47:46 UTC 2026","tests.api.cars.CarsApiTest","AllTests-Chrome","tests.api.cars.CarsApiTest","checkUserCar"
"Создание пользователя с валидными данными через POST /user","949","Проверка создания пользователя через POST /user с валидными данными","AllTestSuite","Sun Jul 12 12:48:12 UTC 2026","passed","Sun Jul 12 12:48:13 UTC 2026","tests.api.users.UsersApiTest","AllTests-Chrome","tests.api.users.UsersApiTest","testCreateUserWithValidData"
"Проверка создания дома с заполнением обязательных полей {floors} и {price} валидными кредами и получением успешного кода выполнения операции","7323","Проверка создания дома с заполнением обязательных полей {floors} и {price} валидными кредами и получением успешного кода выполнения операции","AllTestSuite","Sun Jul 12 13:06:57 UTC 2026","passed","Sun Jul 12 13:07:04 UTC 2026","tests.ui.houses.HousesTest","AllTests-Chrome","tests.ui.houses.HousesTest","checkingTheCreationOfAHouseByFillingInTheRequiredFieldsWithValidCredits"
"Проверка сортировки пользователей по возрастанию наличности","19853","Проверка сортировки пользователей по возрастанию наличности","AllTestSuite","Sun Jul 12 13:19:27 UTC 2026","passed","Sun Jul 12 13:19:47 UTC 2026","tests.ui.users.UsersReadAllTest","AllTests-Chrome","tests.ui.users.UsersReadAllTest","checkSortByMoneyIncrease"
"Позитивный сценарий создания пользователя","17994","Проверка успешного создания пользователя и его отображения в системе","AllTestSuite","Sun Jul 12 13:33:14 UTC 2026","failed","Sun Jul 12 13:33:32 UTC 2026","tests.ui.users.CreateUserTest","AllTests-Chrome","tests.ui.users.CreateUserTest","createValidUserTest"
"Проверка ввода невалидных значений в поля idUser и idCar на странице Cars -> Buy or Sell","7189","Проверка ввода невалидных значений в поля idUser и idCar на странице Cars -> Buy or Sell","AllTestSuite","Sun Jul 12 13:05:32 UTC 2026","passed","Sun Jul 12 13:05:39 UTC 2026","tests.ui.cars.CarsTest","AllTests-Chrome","tests.ui.cars.CarsTest","testInputIdUserError"
"Проверка сортировки пользователей по полу от Z-A","21169","Проверка сортировки пользователей по полу от Z-A","AllTestSuite","Sun Jul 12 13:19:48 UTC 2026","passed","Sun Jul 12 13:20:09 UTC 2026","tests.ui.users.UsersReadAllTest","AllTests-Chrome","tests.ui.users.UsersReadAllTest","checkSortBySexDecrease"
"Проверка корректной сортировки первых 30 значений атрибута ID таблицы Cars по возрастанию","10240","Проверка корректной сортировки первых 30 значений атрибута таблицы ID Cars по возрастанию","AllTestSuite","Sun Jul 12 12:54:01 UTC 2026","passed","Sun Jul 12 12:54:12 UTC 2026","tests.ui.cars.CarsTest","AllTests-Chrome","tests.ui.cars.CarsTest","checkSortIdLowHigh"
"API проверка создания авто POST /car с невалидным телом","287","API проверка создания авто POST /car с невалидным телом","AllTestSuite","Sun Jul 12 12:47:57 UTC 2026","passed","Sun Jul 12 12:47:57 UTC 2026","tests.api.cars.CarsApiTest","AllTests-Chrome","tests.api.cars.CarsApiTest","checkNegativeCreateCar"
"Создание пользователя с невалидными данными","269","Проверка создания пользователя с невалидными данными","AllTestSuite","Sun Jul 12 12:48:22 UTC 2026","passed","Sun Jul 12 12:48:22 UTC 2026","tests.api.users.UsersApiTest","AllTests-Chrome","tests.api.users.UsersApiTest","testCreateUserWithInvalidData"
"API проверка всего цикла CRUD. Создание, получение, изменения и удаление авто","2226","API проверка всего цикла CRUD. Создание, получение, изменения и удаление авто","AllTestSuite","Sun Jul 12 12:47:33 UTC 2026","passed","Sun Jul 12 12:47:35 UTC 2026","tests.api.cars.CarsApiTest","AllTests-Chrome","tests.api.cars.CarsApiTest","checkCarsCRUD"
"Проверка создания автомобиля с невалидными данными со страницы Cars -> Create new","6372","Проверка создания автомобиля с невалидными данными со страницы Cars -> Create new","AllTestSuite","Sun Jul 12 12:51:42 UTC 2026","failed","Sun Jul 12 12:51:49 UTC 2026","tests.ui.cars.CarsTest","AllTests-Chrome","tests.ui.cars.CarsTest","testErrorCreateCar"
"Проверка валидации полей на странице 'Houses/Create new' с получением ошибок при вводе невалидных значений","7588","Проверка валидации полей на странице 'Houses/Create new' с получением ошибок при вводе невалидных значений","AllTestSuite","Sun Jul 12 13:07:31 UTC 2026","passed","Sun Jul 12 13:07:38 UTC 2026","tests.ui.houses.HousesTest","AllTests-Chrome","tests.ui.houses.HousesTest","checkingTheValidationOfFieldsOnTheHousesCreateNewPageAndReceivingErrorsWhenEnteringInvalidValues"
"Проверка корректной сортировки первых 30 значений атрибута Mark таблицы Cars А-Я","24715","Проверка корректной сортировки первых 30 значений атрибута Mark таблицы Cars А-Я","AllTestSuite","Sun Jul 12 12:55:27 UTC 2026","failed","Sun Jul 12 12:55:52 UTC 2026","tests.ui.cars.CarsTest","AllTests-Chrome","tests.ui.cars.CarsTest","checkSortMarkAZ"
"Удаление несуществующего пользователя","271","Проверка удаления несуществующего пользователя","AllTestSuite","Sun Jul 12 12:48:24 UTC 2026","passed","Sun Jul 12 12:48:24 UTC 2026","tests.api.users.UsersApiTest","AllTests-Chrome","tests.api.users.UsersApiTest","testDeleteNonExistentUser"
"Проверка ввода невалидных значений в поля idUser и idCar на странице Cars -> Buy or Sell","7239","Проверка ввода невалидных значений в поля idUser и idCar на странице Cars -> Buy or Sell","AllTestSuite","Sun Jul 12 13:06:49 UTC 2026","failed","Sun Jul 12 13:06:56 UTC 2026","tests.ui.cars.CarsTest","AllTests-Chrome","tests.ui.cars.CarsTest","testInputIdUserError"
"","5349","Проверка обработки ошибок при пополнении баланса","AllTestSuite","Sun Jul 12 13:26:21 UTC 2026","passed","Sun Jul 12 13:26:27 UTC 2026","tests.ui.users.UsersAddMoneyTest","AllTests-Chrome","tests.ui.users.UsersAddMoneyTest","testAddMoneyInvalid"
"Проверка сортировки пользователей по фамилии от Z-A","23768","Проверка сортировки пользователей по фамилии от Z-A","AllTestSuite","Sun Jul 12 13:17:17 UTC 2026","failed","Sun Jul 12 13:17:41 UTC 2026","tests.ui.users.UsersReadAllTest","AllTests-Chrome","tests.ui.users.UsersReadAllTest","checkSortByLastNameDecrease"
"Проверка валидации полей на странице 'Houses/Create new' с получением ошибок при вводе невалидных значений","7581","Проверка валидации полей на странице 'Houses/Create new' с получением ошибок при вводе невалидных значений","AllTestSuite","Sun Jul 12 13:07:15 UTC 2026","passed","Sun Jul 12 13:07:22 UTC 2026","tests.ui.houses.HousesTest","AllTests-Chrome","tests.ui.houses.HousesTest","checkingTheValidationOfFieldsOnTheHousesCreateNewPageAndReceivingErrorsWhenEnteringInvalidValues"
"Проверка открытия страницы ""Users -> Read all"" со всеми атрибутами","11164","Проверка открытия страницы ""Users -> Read all"" со всеми атрибутами","AllTestSuite","Sun Jul 12 13:11:58 UTC 2026","passed","Sun Jul 12 13:12:09 UTC 2026","tests.ui.users.UsersReadAllTest","AllTests-Chrome","tests.ui.users.UsersReadAllTest","checkOpenUsersReadAllPage"
