"DESCRIPTION","DURATION IN MS","NAME","PARENT SUITE","START TIME","STATUS","STOP TIME","SUB SUITE","SUITE","TEST CLASS","TEST METHOD"
"API проверка создания авто POST /car с невалидным телом","295","API проверка создания авто POST /car с невалидным телом","AllTestSuite","Fri Jul 03 08:30:22 UTC 2026","passed","Fri Jul 03 08:30:22 UTC 2026","tests.api.cars.CarsApiTest","AllTests-Chrome","tests.api.cars.CarsApiTest","checkNegativeCreateCar"
"API проверка списка всех авто с помощью ручки GET /cars","1506","API проверка списка всех авто с помощью ручки GET /cars","AllTestSuite","Fri Jul 03 08:30:19 UTC 2026","passed","Fri Jul 03 08:30:21 UTC 2026","tests.api.cars.CarsApiTest","AllTests-Chrome","tests.api.cars.CarsApiTest","checkGetAllCars"
"API проверка получения авто конкретного пользователя GET /user/{userId}/cars","2358","API проверка получения авто конкретного пользователя GET /user/{userId}/cars","AllTestSuite","Fri Jul 03 08:30:17 UTC 2026","passed","Fri Jul 03 08:30:19 UTC 2026","tests.api.cars.CarsApiTest","AllTests-Chrome","tests.api.cars.CarsApiTest","checkUserCar"
"API проверка создания авто POST /car с невалидным телом","417","API проверка создания авто POST /car с невалидным телом","AllTestSuite","Fri Jul 03 08:30:21 UTC 2026","passed","Fri Jul 03 08:30:22 UTC 2026","tests.api.cars.CarsApiTest","AllTests-Chrome","tests.api.cars.CarsApiTest","checkNegativeCreateCar"
"API проверка всего цикла CRUD. Создание, получение, изменения и удаление авто","2213","API проверка всего цикла CRUD. Создание, получение, изменения и удаление авто","AllTestSuite","Fri Jul 03 08:30:14 UTC 2026","passed","Fri Jul 03 08:30:16 UTC 2026","tests.api.cars.CarsApiTest","AllTests-Chrome","tests.api.cars.CarsApiTest","checkCarsCRUD"
